{
  "schemaVersion": "sink-receipt.opsweave.io/v1",
  "receiptId": "99999999-9999-4999-8999-999999999999",
  "jobId": "11111111-1111-4111-8111-111111111111",
  "leaseId": "22222222-2222-4222-8222-222222222222",
  "fencingSequence": 7,
  "sourceBatchKey": "job-11111111-attempt-1-fence-7",
  "datasetId": "host-metrics",
  "schemaRevision": 1,
  "status": "COMMITTED",
  "committedAt": "2026-10-23T00:00:03Z",
  "resultDigest": "sha256:3333333333333333333333333333333333333333333333333333333333333333",
  "effectId": "efx:2d3339ad5676cbf93c0aa569199d0ca0ab8297657da446bc00d161a7051274a8",
  "requestDigest": "sha256:4444444444444444444444444444444444444444444444444444444444444444",
  "pipelineId": "host-metrics-pipeline",
  "pipelineRevision": 1,
  "sinkNodeId": "sink",
  "logicalBatchId": "batch-host-metrics-0001"
}
